{
  "task_id": "MEMORIES-0006",
  "implementation_cycle": 1,
  "change_cycle": 0,
  "status": "ready",
  "slices": [
    {
      "id": "invariant",
      "title": "Invariant",
      "depends_on": [],
      "acceptance_criteria": [
        "AC1",
        "AC2",
        "AC3",
        "AC4",
        "AC5",
        "AC6",
        "AC7",
        "AC8",
        "AC9",
        "AC10",
        "AC11",
        "AC12",
        "AC13",
        "AC14",
        "AC15",
        "AC16",
        "AC17",
        "AC18",
        "AC19",
        "AC20",
        "AC21",
        "AC22"
      ],
      "requirement_details": {
        "Invariant": [
          "Thêm `nestjs-cls` vào `apps/backend/package.json`.",
          "Chọn stable version có peer dependency tương thích với NestJS version hiện tại.",
          "Không sử dụng prerelease.",
          "Verify compatibility trước khi install.",
          "Không upgrade NestJS.",
          "Cập nhật `package-lock.json`.",
          "Ghi selected version trong implementation report.",
          "Không đổi major `nestjs-cls` trong quá trình implement nếu không có documented reason.",
          "Không thêm `@nestjs-cls/transactional`.",
          "Tạo `libs/platform/context`.",
          "Thêm path alias:",
          "Implement runtime context abstraction.",
          "Encapsulate direct dependency tới `nestjs-cls`.",
          "Context lib không import:",
          "Context lib không sở hữu domain-specific store types.",
          "Thêm rule mới vào `.dependency-cruiser.js` (`apps/backend/.dependency-cruiser.js`) để",
          "Hỗ trợ typed namespaced contextual state.",
          "Hỗ trợ:",
          "Không expose unnecessary `nestjs-cls` implementation detail.",
          "Scoped override không mutate parent-owned object.",
          "Có explicit nested policy.",
          "Không rely vào default `ifNested` behavior của library.",
          "Xóa custom `AsyncLocalStorage`.",
          "Dùng shared runtime context infrastructure.",
          "Ưu tiên giữ public API:",
          "Giữ behavior ngoài active context.",
          "Giữ `traceId` behavior nếu hiện có.",
          "Giữ nested scope semantics.",
          "Preserve sibling slices.",
          "Restore parent state sau success/exception.",
          "Không mở nested root CLS trong HTTP middleware flow.",
          "Giữ:",
          "Giữ anonymous/authenticated/system semantics.",
          "Giữ existing `RequestContextStore` shape.",
          "Preserve sibling CLS slices.",
          "Nested `run()` không mutate parent request object.",
          "`runAsSystem()` không làm `isSystemActor` leak về parent.",
          "Restore parent state cả success và exception.",
          "Chỉ có một HTTP root CLS context.",
          "CLS initialize trước các context consumer.",
          "Correlation seed trước request/security seed.",
          "Authentication enrich sau request context seed.",
          "Middleware không gọi facade `run()` để tạo root mới.",
          "Verify actual middleware ordering.",
          "Manual mount CLS initializer tại bootstrap nếu ordering yêu cầu.",
          "Không generate CLS-specific request ID.",
          "Không persist raw request/response nếu không cần.",
          "Không enable `useEnterWith` nếu không có reproduced requirement.",
          "Guard mutate/enrich root `RequestContextStore` hiện tại.",
          "Không tạo CLS root mới.",
          "Không replace object ngoài existing semantics.",
          "Current `correlationId` tiếp tục được serialize vào `BackgroundJobEnvelope`.",
          "Không serialize toàn bộ CLS store.",
          "Không propagate `QueryRunner`.",
          "Không thêm actor propagation.",
          "Không thêm `traceId` propagation nếu hiện tại chưa có.",
          "Nếu publisher có explicit correlation override, giữ precedence semantics hiện tại.",
          "Không inherit HTTP producer store.",
          "Không inherit previous job store.",
          "Concurrent jobs independent.",
          "Cleanup khi success.",
          "Cleanup khi processor throw.",
          "Mỗi command có root CLS execution.",
          "`runAsSystem()` vẫn dẫn tới:",
          "Audit columns vẫn stamp:",
          "Cleanup khi throw.",
          "Không tạo redundant root context.",
          "Nested `runAsSystem()` không mutate parent context.",
          "xác định execution entrypoint;",
          "tạo transport-appropriate CLS root;",
          "đảm bảo cleanup;",
          "đảm bảo concurrency isolation.",
          "Xóa runtime-context imports từ:"
        ]
      },
      "deliverables": [
        "Complete implementation across every applicable architecture layer"
      ],
      "tests": [
        "Happy path, failure path and primary-risk regression tests"
      ],
      "validation": [
        "Configured repository validation and required deterministic skill checks"
      ],
      "status": "completed"
    }
  ]
}
